A1: Ниже приведена таблица с результатами проверки задач младших школьников (основной тур) местным (Новосибирским) жюри. Лучшие работы отправлены для проверки в Москву. Задачи оценены по степени приближения к полному решению (0 - очень далеко, 1 - 100% верное решение) Ребята не решившие ни одной задачи в спиок не включены.
G2: 3 | H2: 4 | I2: 4 | J2: 2 | K2: 3 | L2: 5
A3: Место | B3: Фамилия | C3: Имя | D3: Школа | E3: класс | F3: учитель | G3: 1 | H3: 2 | I3: 3 | J3: 4а | K3: 4б | L3: 5 | M3: Итого
A4: 1 | B4: Закревский | C4: Тимофей | D4: г.3 | E4: 9Ф | F4: Глебов А.Н | G4: 1 | H4: 1 | I4: 1 | J4: 1 | K4: 00.2 | L4: 0 | M4: =G4*G$2+H$2*H4+I4*I$2+J$2*J4+K$2*K4+L4*L$2 -> 13.60
A5: =A4+1 -> 2 | B5: Фомин | C5: Арсен | D5: №119 | E5: 8 | F5: Глебов А.Н | G5: 1 | H5: 1 | I5: 0 | J5: 1 | K5: 1 | L5: 0 | M5: =G5*G$2+H$2*H5+I5*I$2+J$2*J5+K$2*K5+L5*L$2 -> 12.00
A6: =A5+1 -> 3 | B6: Авдюшенко | C6: Александр | D6: №112 | E6: 9 | F6: Глебов А.Н | G6: 1 | H6: 00.3 | I6: 0.5 | J6: 1 | K6: 1 | L6: 00.1 | M6: =G6*G$2+H$2*H6+I6*I$2+J$2*J6+K$2*K6+L6*L$2 -> 11.70
A7: =A6+1 -> 4 | B7: Кван | D7: г.3 | E7: 9Ф | F7: Дорохина Л.А. | G7: 00.1 | H7: 1 | I7: 00.3 | J7: 1 | K7: 1 | L7: 0 | M7: =G7*G$2+H$2*H7+I7*I$2+J$2*J7+K$2*K7+L7*L$2 -> 10.50 | N7: поощрительные места
A8: =A7+1 -> 5 | B8: Макаров | C8: Михаил | D8: г.3 | E8: 9Ф | F8: Глебов А.Н | G8: 1 | H8: 00.6 | I8: 00.7 | J8: 1 | K8: 0 | L8: 0 | M8: =G8*G$2+H$2*H8+I8*I$2+J$2*J8+K$2*K8+L8*L$2 -> 10.20
A9: =A8+1 -> 6 | B9: Рябченко | C9: Александр | D9: №119 | E9: 6 | F9: Глебов А.Н | G9: 1 | H9: 0 | I9: 00.8 | J9: 0.5 | K9: 00.8 | L9: 0 | M9: =G9*G$2+H$2*H9+I9*I$2+J$2*J9+K$2*K9+L9*L$2 -> 9.60
A10: =A9+1 -> 7 | B10: Авдеев | C10: Иван | D10: г.5 | E10: 9В | F10: Колесникова Л. И. | G10: 1 | H10: 0 | I10: 1 | J10: 0 | K10: 0 | L10: 00.3 | M10: =G10*G$2+H$2*H10+I10*I$2+J$2*J10+K$2*K10+L10*L$2 -> 8.50
A11: =A10+1 -> 8 | B11: Муллагалиев | C11: Арсен | D11: №204 | E11: 8И | F11: Ухинова Л. В. | G11: 1 | H11: 0 | I11: 1 | J11: 0 | K11: 0 | L11: 00.3 | M11: =G11*G$2+H$2*H11+I11*I$2+J$2*J11+K$2*K11+L11*L$2 -> 8.50
A12: =A11+1 -> 9 | B12: Ухинов | C12: Александр | D12: №204 | E12: 8И | F12: Ухинова Л. В. | G12: 1 | H12: 0 | I12: 1 | J12: 0 | K12: 0 | L12: 00.3 | M12: =G12*G$2+H$2*H12+I12*I$2+J$2*J12+K$2*K12+L12*L$2 -> 8.50
A13: =A12+1 -> 10 | B13: Сиволобов | C13: Вадим | D13: г. 5 | E13: 9В | F13: Колесникова Л. И. | G13: 1 | H13: 00.2 | I13: 1 | J13: 0 | K13: 0 | L13: 0 | M13: =G13*G$2+H$2*H13+I13*I$2+J$2*J13+K$2*K13+L13*L$2 -> 7.80
A14: =A13+1 -> 11 | B14: Замуренко | C14: Александр | D14: №130 | E14: 9 | G14: 0 | H14: 0.5 | I14: 00.2 | J14: 00.8 | K14: 00.8 | L14: 0 | M14: =G14*G$2+H$2*H14+I14*I$2+J$2*J14+K$2*K14+L14*L$2 -> 6.80
A15: =A14+1 -> 12 | B15: Пак | C15: Николай | D15: №204 | E15: 9 | G15: 00.1 | H15: 00.2 | I15: 00.2 | J15: 0.5 | K15: 1 | L15: 00.1 | M15: =G15*G$2+H$2*H15+I15*I$2+J$2*J15+K$2*K15+L15*L$2 -> 6.40
A16: =A15+1 -> 13 | B16: Якимов | C16: Владислав | D16: г.5 | E16: 9В | F16: Колесникова Л. И. | G16: 1 | H16: 0 | I16: 00.8 | J16: 0 | K16: 0 | L16: 0 | M16: =G16*G$2+H$2*H16+I16*I$2+J$2*J16+K$2*K16+L16*L$2 -> 6.20
A17: =A16+1 -> 14 | B17: Губарев | C17: Всевлод | D17: №119 | E17: 6 | F17: Глебов А.Н | G17: 1 | H17: 0 | I17: 00.2 | J17: 00.7 | K17: 0 | L17: 00.2 | M17: =G17*G$2+H$2*H17+I17*I$2+J$2*J17+K$2*K17+L17*L$2 -> 6.20
A18: =A17+1 -> 15 | B18: Разников | C18: Михаил | D18: №165 | E18: 8 | F18: Прокопьева Т.Н. | G18: 0 | H18: 1 | I18: 0.5 | J18: 0 | K18: 0 | L18: 0 | M18: =G18*G$2+H$2*H18+I18*I$2+J$2*J18+K$2*K18+L18*L$2 -> 6.00
A19: =A18+1 -> 16 | B19: Симоненко | C19: Елизавета | D19: №204 | E19: 9 | G19: 0 | H19: 0 | I19: 1 | J19: 1 | K19: 0 | L19: 0 | M19: =G19*G$2+H$2*H19+I19*I$2+J$2*J19+K$2*K19+L19*L$2 -> 6.00
A20: =A19+1 -> 17 | B20: Ананьин | C20: Федор | D20: №130 | E20: 9А | F20: Эндикова Л.А. | G20: 1 | H20: 0.5 | I20: 0 | J20: 0 | K20: 00.2 | L20: 0 | M20: =G20*G$2+H$2*H20+I20*I$2+J$2*J20+K$2*K20+L20*L$2 -> 5.60
A21: =A20+1 -> 18 | B21: Тикунов | C21: Артем | D21: №130 | E21: 9 | F21: Чусовитина Л.Н. | G21: 0 | H21: 00.4 | I21: 1 | J21: 0 | K21: 0 | L21: 0 | M21: =G21*G$2+H$2*H21+I21*I$2+J$2*J21+K$2*K21+L21*L$2 -> 5.60
A22: =A21+1 -> 19 | B22: Онучин | C22: Михаил | D22: №130 | E22: 9М | F22: Чусовитина Л.Н. | G22: 1 | H22: 0 | I22: 0 | J22: 1 | K22: 0 | L22: 0 | M22: =G22*G$2+H$2*H22+I22*I$2+J$2*J22+K$2*K22+L22*L$2 -> 5.00
A23: =A22+1 -> 20 | B23: Смирнов | C23: Николай | D23: №130 | E23: 9М | F23: Чусовитина Л.Н. | G23: 1 | H23: 0 | I23: 0 | J23: 1 | K23: 0 | L23: 0 | M23: =G23*G$2+H$2*H23+I23*I$2+J$2*J23+K$2*K23+L23*L$2 -> 5.00
A24: =A23+1 -> 21 | B24: Ткачук | C24: Михаил | D24: №190 | E24: 9В | F24: Семенова В.П. | G24: 1 | H24: 0.5 | I24: 0 | J24: 0 | K24: 0 | L24: 0 | M24: =G24*G$2+H$2*H24+I24*I$2+J$2*J24+K$2*K24+L24*L$2 -> 5.00
A25: =A24+1 -> 22 | B25: Чертенков | C25: Игорь | D25: г.5 | E25: 9В | F25: Колесникова Л. И. | G25: 1 | H25: 0.5 | I25: 0 | J25: 0 | K25: 0 | L25: 0 | M25: =G25*G$2+H$2*H25+I25*I$2+J$2*J25+K$2*K25+L25*L$2 -> 5.00
A26: =A25+1 -> 23 | B26: Жданов | C26: Равиль | D26: №163 | E26: 8Б | F26: Яхно Е. В. | G26: 0 | H26: 0 | I26: 0 | J26: 00.8 | K26: 1 | L26: 0 | M26: =G26*G$2+H$2*H26+I26*I$2+J$2*J26+K$2*K26+L26*L$2 -> 4.60
A27: =A26+1 -> 24 | B27: Лобарева | C27: Ольга | D27: №163 | E27: 8В | F27: Лобарев А.И. | G27: 1 | H27: 0 | I27: 00.3 | J27: 0 | K27: 0 | L27: 0 | M27: =G27*G$2+H$2*H27+I27*I$2+J$2*J27+K$2*K27+L27*L$2 -> 4.20
A28: =A27+1 -> 25 | B28: Абаев | C28: Вячеслав | D28: №204 | E28: 8И | F28: Ухинова Л. В. | G28: 0 | H28: 00.6 | I28: 0 | J28: 0 | K28: 0 | L28: 00.3 | M28: =G28*G$2+H$2*H28+I28*I$2+J$2*J28+K$2*K28+L28*L$2 -> 3.90
A29: =A28+1 -> 26 | B29: Ащепков | C29: Олег | D29: №163 | E29: 9 | F29: Яхно Е. В. | G29: 1 | H29: 0 | I29: 0 | J29: 0 | K29: 0 | L29: 0 | M29: =G29*G$2+H$2*H29+I29*I$2+J$2*J29+K$2*K29+L29*L$2 -> 3.00
A30: =A29+1 -> 27 | B30: Бусыгин | C30: Сергей | D30: г.5 | E30: 9 | F30: Глебов А.Н | G30: 0 | H30: 0.5 | I30: 00.2 | J30: 0 | K30: 0 | L30: 0 | M30: =G30*G$2+H$2*H30+I30*I$2+J$2*J30+K$2*K30+L30*L$2 -> 2.80
A31: =A30+1 -> 28 | B31: Рабинович | C31: Борис | D31: №130 | E31: 9 | G31: 0 | H31: 0.5 | I31: 00.2 | J31: 0 | K31: 0 | L31: 0 | M31: =G31*G$2+H$2*H31+I31*I$2+J$2*J31+K$2*K31+L31*L$2 -> 2.80
A32: =A31+1 -> 29 | B32: Курбангалииев | C32: Марат | D32: №119 | E32: 8 | F32: Глебов А.Н | G32: 0 | H32: 0.5 | I32: 0 | J32: 0 | K32: 00.2 | L32: 0 | M32: =G32*G$2+H$2*H32+I32*I$2+J$2*J32+K$2*K32+L32*L$2 -> 2.60
A33: =A32+1 -> 30 | B33: Гребнев | C33: Павел | D33: №204 | E33: 8И | F33: Ухинова Л. В. | G33: 0 | H33: 00.6 | I33: 0 | J33: 0 | K33: 0 | L33: 0 | M33: =G33*G$2+H$2*H33+I33*I$2+J$2*J33+K$2*K33+L33*L$2 -> 2.40
A34: =A33+1 -> 31 | B34: Донцов | C34: Егор | D34: №204 | E34: 8И | F34: Ухинова Л. В. | G34: 0 | H34: 00.6 | I34: 0 | J34: 0 | K34: 0 | L34: 0 | M34: =G34*G$2+H$2*H34+I34*I$2+J$2*J34+K$2*K34+L34*L$2 -> 2.40
A35: =A34+1 -> 32 | B35: Шегуров | C35: Антон | D35: №204 | E35: 8И | F35: Ухинова Л. В. | G35: 0 | H35: 00.6 | I35: 0 | J35: 0 | K35: 0 | L35: 0 | M35: =G35*G$2+H$2*H35+I35*I$2+J$2*J35+K$2*K35+L35*L$2 -> 2.40
A36: =A35+1 -> 33 | B36: Дроздова | C36: Вера | D36: пр.гим. | F36: Москалевский Е.Д. | G36: 0 | H36: 0.5 | I36: 0 | J36: 0 | K36: 0 | L36: 0 | M36: =G36*G$2+H$2*H36+I36*I$2+J$2*J36+K$2*K36+L36*L$2 -> 2.00
A37: =A36+1 -> 34 | B37: Скорая | C37: Евгения | D37: пр.гим. | E37: 8 | F37: Москалевский Е.Д. | G37: 0 | H37: 0.5 | I37: 0 | J37: 0 | K37: 0 | L37: 0 | M37: =G37*G$2+H$2*H37+I37*I$2+J$2*J37+K$2*K37+L37*L$2 -> 2.00
A38: =A37+1 -> 35 | B38: Прохоров | C38: Иван | D38: №119 | E38: 6 | F38: Глебов А.Н | G38: 00.2 | H38: 0 | I38: 00.2 | J38: 0 | K38: 0 | L38: 0 | M38: =G38*G$2+H$2*H38+I38*I$2+J$2*J38+K$2*K38+L38*L$2 -> 1.40
A39: =A38+1 -> 36 | B39: Козионов | C39: Василий | D39: №130 | E39: 8 | G39: 0 | H39: 00.1 | I39: 00.1 | J39: 0 | K39: 0 | L39: 00.1 | M39: =G39*G$2+H$2*H39+I39*I$2+J$2*J39+K$2*K39+L39*L$2 -> 1.30
A40: =A39+1 -> 37 | B40: Гец | C40: Кирилл | D40: №163 | E40: 8Б | F40: Яхно Е. В. | G40: 0 | H40: 0 | I40: 00.3 | J40: 0 | K40: 0 | L40: 0 | M40: =G40*G$2+H$2*H40+I40*I$2+J$2*J40+K$2*K40+L40*L$2 -> 1.20
A41: =A40+1 -> 38 | B41: Балыкина | C41: Татьяна | D41: №163 | E41: 9Б | F41: Н. И. | G41: 0 | H41: 0 | I41: 0 | J41: 00.3 | K41: 0 | L41: 0 | M41: =G41*G$2+H$2*H41+I41*I$2+J$2*J41+K$2*K41+L41*L$2 -> 00.6
A42: =A41+1 -> 39 | B42: Быстрицких | C42: Юлия | D42: №163 | E42: 9Б | F42: Н. И. | G42: 0 | H42: 0 | I42: 0 | J42: 0 | K42: 0 | L42: 0 | M42: =G42*G$2+H$2*H42+I42*I$2+J$2*J42+K$2*K42+L42*L$2 -> 0.00
A43: =A42+1 -> 40 | B43: Троценко | C43: Татьяна | D43: №163 | E43: 8В | F43: Максимова Н.И. | G43: 0 | H43: 0 | I43: 0 | J43: 0 | K43: 0 | L43: 0 | M43: =G43*G$2+H$2*H43+I43*I$2+J$2*J43+K$2*K43+L43*L$2 -> 0.00
A44: =A43+1 -> 41 | B44: Черник | C44: Евгений | D44: г.5 | E44: 9В | F44: Колесникова Л. И. | G44: 0 | H44: 0 | I44: 0 | J44: 0 | K44: 0 | L44: 0 | M44: =G44*G$2+H$2*H44+I44*I$2+J$2*J44+K$2*K44+L44*L$2 -> 0.00