A1: Ниже приведена таблица с результатами проверки задач младших школьников (основной тур) местным (Новосибирским) жюри. Лучшие работы отправлены для проверки в Москву. Задачи оценены по степени приближения к полному решению (0 - очень далеко, 1 - 100% верное решение) Ребята не решившие ни одной задачи в спиок не включены.
K2: задачи | L2: 3 | M2: 5 | N2: 5 | O2: 5 | P2: 3 | Q2: 4 | R2: 7 | S2: 2 | T2: 3 | U2: 3
A3: Место | B3: Фамилия | C3: Имя | D3: Отчество | E3: Школа | F3: Класс | G3: Руководитель | H3: Город | I3: Адрес | J3: телефон | K3: почта | L3: 1 | M3: 2 | N3: 3 | O3: 4 | P3: 5а | Q3: 5б | R3: 6 | S3: 7а | T3: 7б | U3: 7в | V3: Итого
A4: =1 -> 1 | B4: Рост | C4: Дмитрий | D4: Николаевич | E4: гимн.5 | F4: 9 | G4: Глебов А.Н., Савилова О.Н. | H4: Новосибирск | I4: Полевая 16-25 | J4: 362333 | L4: 1 | M4: 0 | N4: 0 | O4: 0 | P4: 0 | Q4: 0 | R4: 1 | S4: 00.8 | T4: 00.9 | U4: 0 | V4: =L4*L$2+M4*M$2+N4*N$2+O4*O$2+P4*P$2+Q4*Q$2+R4*R$2+S4*S$2+T$2*T4+U$2*U4 -> 14.3
A5: =A4+1 -> 2 | B5: Рябченко | C5: Александр | D5: Андреевич | E5: №119 | F5: 6Д | G5: Глебов А.Н. | H5: Новосибирск | I5: Вахтангова 5а -12 | J5: 391357 | L5: 1 | M5: 0 | N5: 0 | O5: 0.5 | P5: 0 | Q5: 0 | R5: 0.5 | S5: 0 | T5: 0 | U5: 0 | V5: =L5*L$2+M5*M$2+N5*N$2+O5*O$2+P5*P$2+Q5*Q$2+R5*R$2+S5*S$2+T$2*T5+U$2*U5 -> 9
A6: =A5+1 -> 3 | B6: Закревский | C6: Тимофей | D6: Дмитриевич | E6: гимн.3 | F6: 9фм | G6: Глебов А.Н. | H6: Новосибирск | I6: Вахтангова 5а -12 | J6: 391357 | L6: 0 | M6: 00.1 | N6: 0 | O6: 0 | P6: 0 | Q6: 0 | R6: 0.5 | S6: 1 | T6: 00.7 | U6: 0 | V6: =L6*L$2+M6*M$2+N6*N$2+O6*O$2+P6*P$2+Q6*Q$2+R6*R$2+S6*S$2+T$2*T6+U$2*U6 -> 8.1
A7: =A6+1 -> 4 | B7: Симоненко | C7: Иван | E7: 204 | F7: 7 | L7: 0 | M7: 1 | N7: 0 | O7: 0.5 | P7: 0 | Q7: 0 | R7: 0 | S7: 0 | T7: 0 | U7: 0 | V7: =L7*L$2+M7*M$2+N7*N$2+O7*O$2+P7*P$2+Q7*Q$2+R7*R$2+S7*S$2+T$2*T7+U$2*U7 -> 7.5
A8: =A7+1 -> 5 | B8: Пак | C8: Николай | D8: Юрьевич | E8: №204 | F8: 9И | G8: Метальникова О.Г. | H8: Новосибирск | I8: Демакова 18 - 120 | J8: 362977 | K8: nicko_ko@hotmail.com | L8: 00.2 | M8: 00.4 | N8: 0 | O8: 00.2 | P8: 0 | Q8: 0 | R8: 0 | S8: 00.6 | T8: 0 | U8: 00.7 | V8: =L8*L$2+M8*M$2+N8*N$2+O8*O$2+P8*P$2+Q8*Q$2+R8*R$2+S8*S$2+T$2*T8+U$2*U8 -> 6.9
A9: =A8+1 -> 6 | B9: Курбоцкий | C9: Евгений | D9: Андреевич | E9: №179 | F9: 8Г | G9: Лютикова Г.М. | H9: Новосибирск | I9: Молодости 26 - 44 | J9: 453676 | L9: 0 | M9: 00.3 | N9: 0 | O9: 1 | P9: 0 | Q9: 0 | R9: 0 | S9: 0 | T9: 0 | U9: 0 | V9: =L9*L$2+M9*M$2+N9*N$2+O9*O$2+P9*P$2+Q9*Q$2+R9*R$2+S9*S$2+T$2*T9+U$2*U9 -> 6.5
A10: =A9+1 -> 7 | B10: Курбангалеев | C10: Марат | E10: 119 | F10: 8 | L10: 0 | M10: 1 | N10: 0 | O10: 00.3 | P10: 0 | Q10: 0 | R10: 0 | S10: 0 | T10: 0 | U10: 0 | V10: =L10*L$2+M10*M$2+N10*N$2+O10*O$2+P10*P$2+Q10*Q$2+R10*R$2+S10*S$2+T$2*T10+U$2*U10 -> 6.5
A11: =A10+1 -> 8 | B11: Муллагалиев | C11: Арсен | D11: Арсенович | E11: 204 | F11: 8и | G11: Максимова Н.И. | H11: Новосибирск | I11: Полевая 12-4 | J11: 362443 | L11: 0 | M11: 00.3 | N11: 0 | O11: 00.3 | P11: 0 | Q11: 0 | R11: 0 | S11: 00.8 | T11: 00.6 | U11: 0 | V11: =L11*L$2+M11*M$2+N11*N$2+O11*O$2+P11*P$2+Q11*Q$2+R11*R$2+S11*S$2+T$2*T11+U$2*U11 -> 6.4
A12: =A11+1 -> 9 | B12: Жданов | C12: Петр | E12: 130 | F12: 9 | L12: 1 | M12: 00.1 | N12: 0 | O12: 00.2 | P12: 00.1 | Q12: 0 | R12: 0 | S12: 0.5 | T12: 0 | U12: 0 | V12: =L12*L$2+M12*M$2+N12*N$2+O12*O$2+P12*P$2+Q12*Q$2+R12*R$2+S12*S$2+T$2*T12+U$2*U12 -> 5.8
A13: =A12+1 -> 10 | B13: Макаров | C13: Михаил | D13: Александрович | E13: гимн.3 | F13: 9фм | L13: 0 | M13: 00.1 | N13: 1 | O13: 0 | P13: 0 | Q13: 0 | R13: 0 | S13: 0 | T13: 0 | U13: 0 | V13: =L13*L$2+M13*M$2+N13*N$2+O13*O$2+P13*P$2+Q13*Q$2+R13*R$2+S13*S$2+T$2*T13+U$2*U13 -> 5.5
A14: =A13+1 -> 11 | B14: Онучин | C14: Михаил | D14: Алексеевич | E14: 130 | F14: 9м | G14: Метальникова О.Г. | H14: Новосибирск | I14: Демакова 18 - 120 | J14: 362977 | K14: nicko_ko@hotmail.com | L14: 0 | M14: 00.3 | N14: 0 | O14: 00.3 | P14: 0 | Q14: 0 | R14: 00.1 | S14: 0 | T14: 00.6 | U14: 0 | V14: =L14*L$2+M14*M$2+N14*N$2+O14*O$2+P14*P$2+Q14*Q$2+R14*R$2+S14*S$2+T$2*T14+U$2*U14 -> 5.5
A15: =A14+1 -> 12 | B15: Ананьин | C15: Федор | D15: Александрович | E15: 130 | F15: 9а | G15: Лютикова Г.М. | H15: Новосибирск | I15: Молодости 26 - 44 | J15: 453676 | L15: 0 | M15: 1 | N15: 0 | O15: 0 | P15: 00.1 | Q15: 0 | R15: 0 | S15: 0 | T15: 0 | U15: 0 | V15: =L15*L$2+M15*M$2+N15*N$2+O15*O$2+P15*P$2+Q15*Q$2+R15*R$2+S15*S$2+T$2*T15+U$2*U15 -> 5.3
A16: =A15+1 -> 13 | B16: Донцов | C16: Егор | D16: Владимирович | E16: 204 | F16: 8и | L16: 0 | M16: 1 | N16: 0 | O16: 0 | P16: 0 | Q16: 0 | R16: 0 | S16: 0 | T16: 0 | U16: 0 | V16: =L16*L$2+M16*M$2+N16*N$2+O16*O$2+P16*P$2+Q16*Q$2+R16*R$2+S16*S$2+T$2*T16+U$2*U16 -> 5
A17: =A16+1 -> 14 | B17: Рабинович | C17: Борис | E17: 130 | F17: 9 | L17: 0 | M17: 00.9 | N17: 0 | O17: 00.1 | P17: 0 | Q17: 0 | R17: 0 | S17: 0 | T17: 0 | U17: 0 | V17: =L17*L$2+M17*M$2+N17*N$2+O17*O$2+P17*P$2+Q17*Q$2+R17*R$2+S17*S$2+T$2*T17+U$2*U17 -> 5
A18: =A17+1 -> 15 | B18: Айзенберг | C18: Алена | D18: Аркадьевна | E18: 119 | F18: 9м | G18: Чусовитина Л.Н. | H18: Новосибирск | I18: Правды 7а - 11 | J18: 302092 | K18: webmaster@mediatrade.ru | L18: 00.6 | M18: 0 | N18: 0 | O18: 00.6 | P18: 0 | Q18: 0 | R18: 0 | S18: 0 | T18: 0 | U18: 0 | V18: =L18*L$2+M18*M$2+N18*N$2+O18*O$2+P18*P$2+Q18*Q$2+R18*R$2+S18*S$2+T$2*T18+U$2*U18 -> 4.8
A19: =A18+1 -> 16 | B19: Серебренников | C19: Андрей | E19: 204 | F19: 9 | L19: 1 | M19: 00.1 | N19: 0 | O19: 0 | P19: 0 | Q19: 0 | R19: 0 | S19: 0 | T19: 00.3 | U19: 0 | V19: =L19*L$2+M19*M$2+N19*N$2+O19*O$2+P19*P$2+Q19*Q$2+R19*R$2+S19*S$2+T$2*T19+U$2*U19 -> 4.4
A20: =A19+1 -> 17 | B20: Прохоров | C20: Иван | D20: Сергеевич | E20: №119 | F20: 6Д | G20: Глебов А.Н., Савилова О.Н. | H20: Новосибирск | I20: Полевая 16-25 | J20: 362333 | L20: 0 | M20: 00.8 | N20: 0 | O20: 0 | P20: 0 | Q20: 0 | R20: 0 | S20: 0 | T20: 0 | U20: 0 | V20: =L20*L$2+M20*M$2+N20*N$2+O20*O$2+P20*P$2+Q20*Q$2+R20*R$2+S20*S$2+T$2*T20+U$2*U20 -> 4
A21: =A20+1 -> 18 | B21: Вавилов | C21: Павел | D21: Владиславович | E21: 179 | F21: 8г | G21: Дорохина Л.А. | H21: Новосибирск | I21: Иванова 35а - 26 | J21: 399073 | L21: 00.6 | M21: 0 | N21: 0 | O21: 00.3 | P21: 0 | Q21: 0 | R21: 0 | S21: 0 | T21: 0 | U21: 0 | V21: =L21*L$2+M21*M$2+N21*N$2+O21*O$2+P21*P$2+Q21*Q$2+R21*R$2+S21*S$2+T$2*T21+U$2*U21 -> 3.3
A22: =A21+1 -> 19 | B22: Губарев | C22: Всевлод | D22: Юрьевич | E22: №119 | F22: 6Д | G22: Глебов А.Н. | H22: Новосибирск | I22: Шлюзовая | J22: 338538 | L22: 00.2 | M22: 00.2 | N22: 0 | O22: 0 | P22: 0 | Q22: 0 | R22: 0 | S22: 00.8 | T22: 0 | U22: 0 | V22: =L22*L$2+M22*M$2+N22*N$2+O22*O$2+P22*P$2+Q22*Q$2+R22*R$2+S22*S$2+T$2*T22+U$2*U22 -> 3.2
A23: =A22+1 -> 20 | B23: Авдюшенко | C23: Александр | E23: 112 | F23: 9 | L23: 1 | M23: 0 | N23: 0 | O23: 0 | P23: 0 | Q23: 0 | R23: 0 | S23: 0 | T23: 0 | U23: 0 | V23: =L23*L$2+M23*M$2+N23*N$2+O23*O$2+P23*P$2+Q23*Q$2+R23*R$2+S23*S$2+T$2*T23+U$2*U23 -> 3
A24: =A23+1 -> 21 | B24: Бусыгин | C24: Сергей | D24: Владимирович | E24: гимн.5 | F24: 9 | L24: 0 | M24: 00.6 | N24: 0 | O24: 0 | P24: 0 | Q24: 0 | R24: 0 | S24: 0 | T24: 0 | U24: 0 | V24: =L24*L$2+M24*M$2+N24*N$2+O24*O$2+P24*P$2+Q24*Q$2+R24*R$2+S24*S$2+T$2*T24+U$2*U24 -> 3
A25: =A24+1 -> 22 | B25: Дроздова | C25: Вера | D25: Геннадьевна | E25: прав.гимн. | F25: 8 | G25: Мазур М.И. | H25: Новосибирск | I25: Сиреневая 27 -20 | J25: 327245 | L25: 0 | M25: 00.6 | N25: 0 | O25: 0 | P25: 0 | Q25: 0 | R25: 0 | S25: 0 | T25: 0 | U25: 0 | V25: =L25*L$2+M25*M$2+N25*N$2+O25*O$2+P25*P$2+Q25*Q$2+R25*R$2+S25*S$2+T$2*T25+U$2*U25 -> 3
A26: =A25+1 -> 23 | B26: Смирнов | C26: Николай | D26: Андреевич | E26: №130 | F26: 9М | G26: Чусовитина Л.Н. | H26: Новосибирск | I26: Правды 7а - 11 | J26: 302092 | K26: webmaster@mediatrade.ru | L26: 00.2 | M26: 00.4 | N26: 0 | O26: 0 | P26: 0 | Q26: 0 | R26: 0 | S26: 00.2 | T26: 0 | U26: 0 | V26: =L26*L$2+M26*M$2+N26*N$2+O26*O$2+P26*P$2+Q26*Q$2+R26*R$2+S26*S$2+T$2*T26+U$2*U26 -> 3
A27: =A26+1 -> 24 | B27: Якимов | C27: Владислав | D27: Николаевич | E27: гимн.5 | F27: 9 | L27: 0 | M27: 0 | N27: 0 | O27: 00.6 | P27: 0 | Q27: 0 | R27: 0 | S27: 0 | T27: 0 | U27: 0 | V27: =L27*L$2+M27*M$2+N27*N$2+O27*O$2+P27*P$2+Q27*Q$2+R27*R$2+S27*S$2+T$2*T27+U$2*U27 -> 3
A28: =A27+1 -> 25 | B28: Кван | C28: Евгений | E28: г.3 | F28: 9 | L28: 0 | M28: 0.5 | N28: 0 | O28: 0 | P28: 0 | Q28: 0 | R28: 0 | S28: 0 | T28: 0 | U28: 0 | V28: =L28*L$2+M28*M$2+N28*N$2+O28*O$2+P28*P$2+Q28*Q$2+R28*R$2+S28*S$2+T$2*T28+U$2*U28 -> 2.5
A29: =A28+1 -> 26 | B29: Миронова | C29: Галина | D29: Юрьевна | E29: №163 | F29: 8В | G29: Максимова Н.И. | H29: Новосибирск | I29: Полевая 12-4 | J29: 362443 | L29: 0 | M29: 0 | N29: 0 | O29: 0.5 | P29: 0 | Q29: 0 | R29: 0 | S29: 0 | T29: 0 | U29: 0 | V29: =L29*L$2+M29*M$2+N29*N$2+O29*O$2+P29*P$2+Q29*Q$2+R29*R$2+S29*S$2+T$2*T29+U$2*U29 -> 2.5
A30: =A29+1 -> 27 | B30: Катышев | C30: Александр | E30: г.3 | F30: 9ФМ | G30: Дорохина Л.А. | H30: Новосибирск | I30: Иванова 35а - 26 | J30: 399073 | L30: 0 | M30: 00.4 | N30: 0 | O30: 0 | P30: 0 | Q30: 0 | R30: 0 | S30: 0 | T30: 0 | U30: 0 | V30: =L30*L$2+M30*M$2+N30*N$2+O30*O$2+P30*P$2+Q30*Q$2+R30*R$2+S30*S$2+T$2*T30+U$2*U30 -> 2
A31: =A30+1 -> 28 | B31: Пономарев | C31: Павел | D31: Валерьевич | E31: №204 | F31: 7И | G31: Винс О.А. | H31: Новосибирск | I31: Арбузова 16-17 | J31: 391151 | L31: 0 | M31: 00.4 | N31: 0 | O31: 0 | P31: 0 | Q31: 0 | R31: 0 | S31: 0 | T31: 0 | U31: 0 | V31: =L31*L$2+M31*M$2+N31*N$2+O31*O$2+P31*P$2+Q31*Q$2+R31*R$2+S31*S$2+T$2*T31+U$2*U31 -> 2
A32: =A31+1 -> 29 | B32: Шегуров | C32: Антон | D32: Анатольевич | E32: №204 | F32: 8И | G32: Ухинова Л.В. | H32: Новосибирск | I32: Полевая 16-202 | J32: 361334 | L32: 0 | M32: 00.4 | N32: 0 | O32: 0 | P32: 0 | Q32: 0 | R32: 0 | S32: 0 | T32: 0 | U32: 0 | V32: =L32*L$2+M32*M$2+N32*N$2+O32*O$2+P32*P$2+Q32*Q$2+R32*R$2+S32*S$2+T$2*T32+U$2*U32 -> 2
A33: =A32+1 -> 30 | B33: Бессмельцев | C33: Михаил | D33: Викторович | E33: 204 | F33: 8и | G33: Ухинова Л.В. | H33: Новосибирск | I33: Полевая 16-202 | J33: 361334 | L33: 0 | M33: 00.3 | N33: 0 | O33: 0 | P33: 0 | Q33: 0 | R33: 0 | S33: 0 | T33: 0 | U33: 0 | V33: =L33*L$2+M33*M$2+N33*N$2+O33*O$2+P33*P$2+Q33*Q$2+R33*R$2+S33*S$2+T$2*T33+U$2*U33 -> 1.5
A34: =A33+1 -> 31 | B34: Дугаржапов | C34: Алдар | D34: Эрдэмович | E34: 179 | F34: 8г | G34: Винс О.А. | H34: Новосибирск | I34: Арбузова 16-17 | J34: 391151 | L34: 0 | M34: 0 | N34: 0 | O34: 00.3 | P34: 0 | Q34: 0 | R34: 0 | S34: 0 | T34: 0 | U34: 0 | V34: =L34*L$2+M34*M$2+N34*N$2+O34*O$2+P34*P$2+Q34*Q$2+R34*R$2+S34*S$2+T$2*T34+U$2*U34 -> 1.5
A35: =A34+1 -> 32 | B35: Никифоров | C35: Борис | E35: г.3 | F35: 9 | L35: 0 | M35: 00.1 | N35: 0 | O35: 00.2 | P35: 0 | Q35: 0 | R35: 0 | S35: 0 | T35: 0 | U35: 0 | V35: =L35*L$2+M35*M$2+N35*N$2+O35*O$2+P35*P$2+Q35*Q$2+R35*R$2+S35*S$2+T$2*T35+U$2*U35 -> 1.5
A36: =A35+1 -> 33 | B36: Шакурова | C36: Юлия | D36: Даниловна | E36: №179 | F36: 8Г | G36: Лютикова Г.М. | H36: Новосибирск | I36: Ветлужская 30-203 | J36: 454907 | L36: 0 | M36: 0 | N36: 0 | O36: 00.2 | P36: 0 | Q36: 0 | R36: 0 | S36: 00.2 | T36: 0 | U36: 0 | V36: =L36*L$2+M36*M$2+N36*N$2+O36*O$2+P36*P$2+Q36*Q$2+R36*R$2+S36*S$2+T$2*T36+U$2*U36 -> 1.4
A37: =A36+1 -> 34 | B37: Хоруженко | C37: Анна | E37: 204 | F37: 7 | L37: 0 | M37: 0 | N37: 0 | O37: 00.2 | P37: 0 | Q37: 0 | R37: 0 | S37: 0 | T37: 0 | U37: 0 | V37: =L37*L$2+M37*M$2+N37*N$2+O37*O$2+P37*P$2+Q37*Q$2+R37*R$2+S37*S$2+T$2*T37+U$2*U37 -> 1
A38: =A37+1 -> 35 | B38: Чертенков | C38: Игорь | E38: г.5 | F38: 9 | L38: 0 | M38: 0 | N38: 0 | O38: 00.2 | P38: 0 | Q38: 0 | R38: 0 | S38: 0 | T38: 0 | U38: 0 | V38: =L38*L$2+M38*M$2+N38*N$2+O38*O$2+P38*P$2+Q38*Q$2+R38*R$2+S38*S$2+T$2*T38+U$2*U38 -> 1
A39: =A38+1 -> 36 | B39: Лобарева | C39: Ольга | D39: Игоревна | E39: 163 | F39: 8в | G39: Глебов А.Н. | H39: Новосибирск | I39: Шлюзовая | J39: 338538 | L39: 0 | M39: 0 | N39: 0 | O39: 0 | P39: 0 | Q39: 0 | R39: 0 | S39: 0 | T39: 00.3 | U39: 0 | V39: =L39*L$2+M39*M$2+N39*N$2+O39*O$2+P39*P$2+Q39*Q$2+R39*R$2+S39*S$2+T$2*T39+U$2*U39 -> 00.9
A40: =A39+1 -> 37 | B40: Трусов | C40: Михайл | E40: 119 | F40: 8 | L40: 0 | M40: 00.1 | N40: 0 | O40: 0 | P40: 0 | Q40: 0 | R40: 00.05 | S40: 0 | T40: 0 | U40: 0 | V40: =L40*L$2+M40*M$2+N40*N$2+O40*O$2+P40*P$2+Q40*Q$2+R40*R$2+S40*S$2+T$2*T40+U$2*U40 -> 00.85
A41: =A40+1 -> 38 | B41: Скорая | C41: Евгения | D41: Вадимовна | E41: прав.гимн. | F41: 8 | L41: 0 | M41: 00.1 | N41: 0 | O41: 0 | P41: 0 | Q41: 0 | R41: 0 | S41: 0 | T41: 0 | U41: 0 | V41: =L41*L$2+M41*M$2+N41*N$2+O41*O$2+P41*P$2+Q41*Q$2+R41*R$2+S41*S$2+T$2*T41+U$2*U41 -> 0.5
A42: =A41+1 -> 39 | B42: Герасев | C42: Александр | E42: 204 | F42: 9 | L42: 00.1 | M42: 0 | N42: 0 | O42: 0 | P42: 0 | Q42: 0 | R42: 0 | S42: 0 | T42: 0 | U42: 0 | V42: =L42*L$2+M42*M$2+N42*N$2+O42*O$2+P42*P$2+Q42*Q$2+R42*R$2+S42*S$2+T$2*T42+U$2*U42 -> 00.3
A43: =A42+1 -> 40 | B43: Макаров | C43: Аркадий | D43: Глебович | E43: 204 | F43: 8и | G43: Лютикова Г.М. | H43: Новосибирск | I43: Ветлужская 30-203 | J43: 454907 | L43: 0 | M43: 0 | N43: 0 | O43: 0 | P43: 0 | Q43: 0 | R43: 0 | S43: 0 | T43: 0 | U43: 0 | V43: =L43*L$2+M43*M$2+N43*N$2+O43*O$2+P43*P$2+Q43*Q$2+R43*R$2+S43*S$2+T$2*T43+U$2*U43 -> 0
A44: =A43+1 -> 41 | B44: Сиволобов | C44: Вадим | D44: Николаевич | E44: гимн.5 | F44: 9в | L44: 0 | M44: 0 | N44: 0 | O44: 0 | P44: 0 | Q44: 0 | R44: 0 | S44: 0 | T44: 0 | U44: 0 | V44: =L44*L$2+M44*M$2+N44*N$2+O44*O$2+P44*P$2+Q44*Q$2+R44*R$2+S44*S$2+T$2*T44+U$2*U44 -> 0
A45: =A44+1 -> 42 | B45: Ткачук | C45: Михаил | D45: Викторович | E45: 190 | F45: 9в | L45: 0 | M45: 0 | N45: 0 | O45: 0 | P45: 0 | Q45: 0 | R45: 0 | S45: 0 | T45: 0 | U45: 0 | V45: =L45*L$2+M45*M$2+N45*N$2+O45*O$2+P45*P$2+Q45*Q$2+R45*R$2+S45*S$2+T$2*T45+U$2*U45 -> 0
A46: =A45+1 -> 43 | B46: Ухинов | C46: Александр | D46: Сергеевич | E46: 204 | F46: 8и | L46: 0 | M46: 0 | N46: 0 | O46: 0 | P46: 0 | Q46: 0 | R46: 0 | S46: 0 | T46: 0 | U46: 0 | V46: =L46*L$2+M46*M$2+N46*N$2+O46*O$2+P46*P$2+Q46*Q$2+R46*R$2+S46*S$2+T$2*T46+U$2*U46 -> 0
A47: =A46+1 -> 44 | B47: Фомин | C47: Арсений | D47: Эдуардович | E47: №119 | F47: 8А | G47: Мазур М.И. | H47: Новосибирск | I47: Сиреневая 27 -20 | J47: 327245 | L47: 0 | M47: 0 | N47: 0 | O47: 0 | P47: 0 | Q47: 0 | R47: 0 | S47: 0 | T47: 0 | U47: 0 | V47: =L47*L$2+M47*M$2+N47*N$2+O47*O$2+P47*P$2+Q47*Q$2+R47*R$2+S47*S$2+T$2*T47+U$2*U47 -> 0